{
  "id": "11111111-1111-4111-8111-111111111111",
  "conversation_id": "22222222-2222-4222-8222-222222222222",
  "sender_id": "33333333-3333-4333-8333-333333333333",
  "content_type": "text",
  "payload": {
    "text": "Hello from the canonical contract"
  },
  "reply_to_id": null,
  "status": "sent",
  "metadata": {
    "schema_version": 1,
    "revision": 1,
    "reactions": [],
    "pin": {
      "is_pinned": false,
      "pinned_by": null,
      "pinned_at": null
    },
    "is_starred_by_me": false,
    "forwarded": {
      "original_message_id": null,
      "original_sender_id": null,
      "original_sender_name": null,
      "original_created_at": null
    },
    "receipts": {
      "delivered_count": 0,
      "read_count": 0,
      "read_by_me_at": null
    },
    "ephemeral": {
      "view_once": false,
      "viewed_at": null,
      "expires_at": null
    },
    "edited_at": null,
    "deleted_at": null
  },
  "created_at": "2026-07-16T12:00:00.000Z",
  "updated_at": "2026-07-16T12:00:00.000Z"
}
